<?xml version="1.0" encoding="UTF-8"?>
<!-- XML Sample Message of message hierarchy                                          -->
<!-- Message:             ADC GL Accounts Period Balance v1.0 Rev. 6                  -->
<!-- Transaction:         AA - Audit Data Collection Rev. 271                         -->
<!-- Datamodel:           Audit Data Collection Datamodel, version HEAD Rev. 347      -->
<!-- XML tagset used:     AdcsML                                                      -->
<!-- Generated at:        02-05-2021 15:53:56                                         -->
<!-- Generated using:     EC-Design 2.5.0 (http://www.ec-design.nl)                   -->
<!-- Generated by:        Jan Vrijenhoek (Digitect)                                   -->
<!-- Organisation:        Digitect B.V. (Digitect)                                    -->
<!-- NOTE:    This sample message was generated automatically: manual modifications will be lost -->
<AdcGlAccountsPeriodBalance xsi:schemaLocation="http://schemas.iso.org/AdcsML/Messages/AdcGlAccountsPeriodBalance-v1 AdcGlAccountsPeriodBalance-v1.0.xsd"
		xmlns="http://schemas.iso.org/AdcsML/Messages/AdcGlAccountsPeriodBalance-v1"
		xmlns:xsi="http://www.w3.org/2001/XMLSchema-instance">
	<GlAcntPerBal>
		<GlAcntNr>ACC123456789</GlAcntNr>
		<FiscYr>2020</FiscYr>
		<AcntingPer>M1</AcntingPer>
		<DbQt>100.0000</DbQt>
		<CrQt>100.0000</CrQt>
		<BegQt>0.0000</BegQt>
		<EndQt>0.0000</EndQt>
		<UomCd>KG</UomCd>
		<BegBalInd>C</BegBalInd>
		<EndBalInd>C</EndBalInd>
		<AcntSgEmp>E001</AcntSgEmp>
		<AcntSgProj>P001</AcntSgProj>
		<AcntSgBankAcnt>NL99BANK1234123412</AcntSgBankAcnt>
		<DbAmt>
			<FuncAmt>125.1255</FuncAmt>
			<TrAmt>125.1255</TrAmt>
			<RprtAmt>125.1255</RprtAmt>
			<LocAmt>125.1255</LocAmt>
		</DbAmt>
		<CrAmt>
			<FuncAmt>125.1255</FuncAmt>
			<TrAmt>125.1255</TrAmt>
			<RprtAmt>125.1255</RprtAmt>
			<LocAmt>125.1255</LocAmt>
		</CrAmt>
		<BalBegAmt>
			<FuncAmt>125.1255</FuncAmt>
			<TrAmt>125.1255</TrAmt>
			<RprtAmt>125.1255</RprtAmt>
			<LocAmt>125.1255</LocAmt>
		</BalBegAmt>
		<BalEndAmt>
			<FuncAmt>125.1255</FuncAmt>
			<TrAmt>125.1255</TrAmt>
			<RprtAmt>125.1255</RprtAmt>
			<LocAmt>125.1255</LocAmt>
		</BalEndAmt>
		<Cur>
			<FuncCurCd>USD</FuncCurCd>
			<TrCurCd>USD</TrCurCd>
			<RprtCurCd>USD</RprtCurCd>
			<LocCurCd>USD</LocCurCd>
		</Cur>
		<AcntSg>
			<AcntSgNr>1</AcntSgNr>
			<AcntSgCd>6900</AcntSgCd>
		</AcntSg>
		<BusSg>
			<BusSgCd>1234</BusSgCd>
		</BusSg>
	</GlAcntPerBal>
</AdcGlAccountsPeriodBalance>
